{
  "$schema": "https://json-schema.org/draft/2020-12/schema",
  "$id": "https://flowmemory.local/schemas/flowmemory/bridge-deposit.schema.json",
  "title": "FlowChainBridgeDeposit",
  "type": "object",
  "additionalProperties": false,
  "required": [
    "schema",
    "depositId",
    "sourceChainId",
    "sourceContract",
    "txHash",
    "logIndex",
    "token",
    "amount",
    "sender",
    "flowchainRecipient",
    "nonce",
    "status"
  ],
  "properties": {
    "schema": { "const": "flowmemory.bridge_deposit.v0" },
    "depositId": { "type": "string", "pattern": "^0x[0-9a-fA-F]{64}$" },
    "sourceChainId": { "type": "integer", "enum": [31337, 84532, 8453] },
    "sourceContract": { "type": "string", "pattern": "^0x[0-9a-fA-F]{40}$" },
    "txHash": { "type": "string", "pattern": "^0x[0-9a-fA-F]{64}$" },
    "logIndex": { "type": "integer", "minimum": 0 },
    "sourceBlockNumber": { "type": "string", "pattern": "^[0-9]+$" },
    "sourceBlockHash": { "type": "string", "pattern": "^0x[0-9a-fA-F]{64}$" },
    "transactionIndex": { "type": "integer", "minimum": 0 },
    "token": { "type": "string", "pattern": "^0x[0-9a-fA-F]{40}$" },
    "amount": { "type": "string", "pattern": "^[0-9]+$" },
    "sender": { "type": "string", "pattern": "^0x[0-9a-fA-F]{40}$" },
    "flowchainRecipient": { "type": "string", "pattern": "^0x[0-9a-fA-F]{64}$" },
    "nonce": { "type": "string", "pattern": "^[0-9]+$" },
    "metadataHash": { "type": "string", "pattern": "^0x[0-9a-fA-F]{64}$" },
    "status": { "type": "string", "enum": ["observed", "accepted_local", "rejected", "released", "failed"] }
  }
}
