{
  "schema": "flowmemory.bridge_deposit.v0",
  "depositId": "0x7e3a7f7ab7dc9b07d762c1f2fce315cf0c08f1a7e854b4dbcb2359efcb9cb269",
  "sourceChainId": 84532,
  "sourceContract": "0x1111111111111111111111111111111111111111",
  "txHash": "0x2222222222222222222222222222222222222222222222222222222222222222",
  "logIndex": 0,
  "token": "0x3333333333333333333333333333333333333333",
  "amount": "20000000",
  "sender": "0x4444444444444444444444444444444444444444",
  "flowchainRecipient": "0x5555555555555555555555555555555555555555555555555555555555555555",
  "nonce": "1",
  "metadataHash": "0x6666666666666666666666666666666666666666666666666666666666666666",
  "status": "observed"
}
