{
  "schema": "flowmemory.bridge_deposit.v0",
  "depositId": "0x8453000000000000000000000000000000000000000000000000000000000001",
  "sourceChainId": 8453,
  "sourceContract": "0x1111111111111111111111111111111111111111",
  "txHash": "0x8453000000000000000000000000000000000000000000000000000000000002",
  "logIndex": 0,
  "sourceBlockNumber": "100",
  "sourceBlockHash": "0x8453000000000000000000000000000000000000000000000000000000000003",
  "transactionIndex": 1,
  "token": "0x3333333333333333333333333333333333333333",
  "amount": "20000000",
  "sender": "0x4444444444444444444444444444444444444444",
  "flowchainRecipient": "0x1234567890abcdef1234567890abcdef1234567890abcdef1234567890abcdef",
  "nonce": "1",
  "metadataHash": "0x0000000000000000000000000000000000000000000000000000000000000000",
  "status": "observed"
}
